18524 Latin_America "Latin America is a group of countries and dependencies in the Western Hemisphere where Romance languages such as Spanish, Portuguese, and French are predominantly spoken; it is broader than the terms Ibero-America or Hispanic America. The term ""Latin America"" was first used in an 1856 conference with the title ""Initiative of the Americas. Idea for a Federal Congress of the Republics"" (Iniciativa de la América. Idea de un Congreso Federal de las Repúblicas), by the Chilean politician Francisco Bilbao. The term was used also by Napoleon III's French government in the 1860s as Amérique latine to consider French-speaking territories in the Americas (French Canadians, French Louisiana, French Guiana, Haiti, Guadeloupe, Martinique, Saint Martin, Saint Barthélemy), along with the larger group of countries where Spanish and Portuguese languages prevailed, including the Spanish-speaking portions of the United States (Southwestern United States and Florida) Today, areas of Canada (such as Quebec) and the United States (with the exception of Puerto Rico) where Spanish, Portuguese and French are predominant are typically not included in definitions of Latin America. Latin America consists of 13 dependencies and 20 countries which cover an area that stretches from the northern border of Mexico to the southern tip of South America, including the Caribbean. It has an area of approximately 19,197,000 km2 (7,412,000 sq mi), almost 13% of the Earth's land surface area. As of 2018, its population was estimated at more than  642 million and in 2014, Latin America had a combined nominal GDP of US$5,573,397 million and a GDP PPP of 7,531,585 million USD."
20377 Microorganism "A microorganism, or microbe, is a microscopic organism, which may exist in its single-celled form or in a colony of cells. The possible existence of unseen microbial life was suspected from ancient times, such as in Jain scriptures from 6th century BC India and the 1st century BC book On Agriculture by Marcus Terentius Varro. Microbiology, the scientific study of microorganisms, began with their observation under the microscope in the 1670s by Antonie van Leeuwenhoek. In the 1850s, Louis Pasteur found that microorganisms caused food spoilage, debunking the theory of spontaneous generation. In the 1880s, Robert Koch discovered that microorganisms caused the diseases tuberculosis, cholera and anthrax. Microorganisms include all unicellular organisms and so are extremely diverse. Of the three domains of life identified by Carl Woese, all of the Archaea and Bacteria are microorganisms. These were previously grouped together in the two domain system as Prokaryotes, the other being the eukaryotes. The third domain Eukaryota includes all multicellular organisms and many unicellular protists and protozoans. Some protists are related to animals and some to green plants. Many of the multicellular organisms are microscopic, namely micro-animals, some fungi and some algae, but these are not discussed here. They live in almost every habitat from the poles to the equator, deserts, geysers, rocks and the deep sea. Some are adapted to extremes such as very hot or very cold conditions, others to high pressure and a few such as Deinococcus radiodurans to high radiation environments. Microorganisms also make up the microbiota found in and on all multicellular organisms. A December 2017 report stated that 3.45-billion-year-old Australian rocks once contained microorganisms, the earliest direct evidence of life on Earth.Microbes are important in human culture and health in many ways, serving to ferment foods, treat sewage, produce fuel, enzymes and other bioactive compounds. They are essential tools in biology as model organisms and have been put to use in biological warfare and bioterrorism. They are a vital component of fertile soils. In the human body microorganisms make up the human microbiota including the essential gut flora. They are the pathogens responsible for many infectious diseases and as such are the target of hygiene measures."
22055 Neil_Gaiman "Neil Richard MacKinnon Gaiman (; born Neil Richard Gaiman, 10 November 1960) is an English author of short fiction, novels, comic books, graphic novels, nonfiction, audio theatre, and films. His  works include the comic book series The Sandman and novels Stardust, American Gods, Coraline, and The Graveyard Book. He has won numerous awards, including the Hugo, Nebula, and Bram Stoker awards, as well as the Newbery and Carnegie medals. He is the first author to win both the Newbery and the Carnegie medals for the same work, The Graveyard Book (2008). In 2013, The Ocean at the End of the Lane was voted Book of the Year in the British National Book Awards."
25507 Roman_Empire "The Roman Empire (Latin: Imperium Rōmānum, Classical Latin: [ɪmˈpɛrɪ.ũː roːˈmaːnũː]; Koinē Greek: Βασιλεία τῶν Ῥωμαίων, romanized: Basileía tōn Rhōmaíōn) was the post-Republican period of ancient Rome, consisting of large territorial holdings around the Mediterranean sea in Europe, North Africa and West Asia ruled by emperors. From the accession of Caesar Augustus to the military anarchy of the third century, it was a principate with Italy as metropole of the provinces and its city of Rome as sole capital (27 BC – 286 AD). The Roman Empire was then ruled by multiple emperors and divided into a Western Roman Empire, based in Milan and later Ravenna, and an Eastern Roman Empire, based in Nicomedia and later Constantinople. Rome remained the nominal capital of both parts until 476 AD, when it sent the imperial insignia to Constantinople (Byzantium in Ancient Greek) following the capture of Ravenna by the barbarians of Odoacer and the subsequent deposition of Romulus Augustus. The fall of the Western Roman Empire to Germanic kings, along with the hellenization of the Eastern Roman Empire into the Byzantine Empire, is conventionally used to mark the end of Ancient Rome and the beginning of the Middle Ages. The previous Roman Republic, which had replaced Rome's monarchy in the 6th century BC, became severely destabilized in a series of civil wars and political conflict. In the mid-1st century BC Julius Caesar was appointed as perpetual dictator and then assassinated in 44 BC. Civil wars and proscriptions continued, culminating in the victory of Octavian, Caesar's adopted son, over Mark Antony and Cleopatra at the Battle of Actium in 31 BC. The following year Octavian conquered Ptolemaic Egypt, ending the Hellenistic period that had begun with the conquests of Alexander the Great of Macedon in the 4th century BC. Octavian's power was then unassailable and in 27 BC the Roman Senate formally granted him overarching power and the new title Augustus, effectively making him the first emperor. The first two centuries of the Empire were a period of unprecedented stability and prosperity known as the Pax Romana (""Roman Peace""). It reached its greatest territorial expanse during the reign of Trajan (98–117 AD). A period of increasing trouble and decline began with the reign of Commodus. In the 3rd century, the Empire underwent a crisis that threatened its existence, but was reunified under Aurelian. In an effort to stabilize the Empire, Diocletian set up two different imperial courts in the Greek East and Latin West. Christians rose to power in the 4th century following the Edict of Milan in 313 and the Edict of Thessalonica in 380. Shortly after, the Migration Period involving large invasions by Germanic peoples and the Huns of Attila led to the decline of the Western Roman Empire. With the fall of Ravenna to the Germanic Herulians and the deposition of Romulus Augustulus in 476 AD by Odoacer, the Western Roman Empire finally collapsed and it was formally abolished by emperor Zeno in 480 AD. The Eastern Roman Empire, known in the post-Roman West as the Byzantine Empire, collapsed when Constantinople fell to the Ottoman Turks of Mehmed II in 1453. Due to the Roman Empire's vast extent and long endurance, the institutions and culture of Rome had a profound and lasting influence on the development of language, religion, architecture, philosophy, law, and forms of government in the territory it governed, particularly Europe. The Latin language of the Romans evolved into the Romance languages of the medieval and modern world, while Medieval Greek became the language of the Eastern Roman Empire. Its adoption of Christianity led to the formation of Christendom during the Middle Ages. Greek and Roman art had a profound impact on the late medieval Italian Renaissance, while Rome's republican institutions influenced the political development of later republics such as the United States and France. The corpus of Roman law has its descendants in many legal systems of the world today, such as the Napoleonic Code. Rome's architectural tradition served as the basis for Neoclassical architecture."
26537 Rose "A rose is a woody perennial flowering plant of the genus Rosa, in the family Rosaceae, or the flower it bears.  There are over three hundred species and thousands of cultivars.  They form a group of plants that can be erect shrubs, climbing, or trailing, with stems that are often armed with sharp prickles.  Flowers vary in size and shape and are usually large and showy, in colours ranging from white through yellows and reds.  Most species are native to Asia, with smaller numbers native to Europe, North America, and northwestern Africa. Species, cultivars and hybrids are all widely grown for their beauty and often are fragrant.  Roses have acquired cultural significance in  many societies.  Rose plants range in size from compact, miniature roses, to climbers that can reach seven meters in height. Different species hybridize easily, and this has been used in the development of the wide range of garden roses."
29370 Snake "Snakes are elongated, legless, carnivorous reptiles of the suborder Serpentes. Like all other squamates, snakes are ectothermic, amniote vertebrates covered in overlapping scales. Many species of snakes have skulls with several more joints than their lizard ancestors, enabling them to swallow prey much larger than their heads with their highly mobile jaws. To accommodate their narrow bodies, snakes' paired organs (such as kidneys) appear one in front of the other instead of side by side, and most have only one functional lung. Some species retain a pelvic girdle with a pair of vestigial claws on either side of the cloaca. Lizards have evolved elongate bodies without limbs or with greatly reduced limbs about twenty-five times independently via convergent evolution, leading to many lineages of legless lizards.  Legless lizards resemble snakes, but several common groups of legless lizards have eyelids and external ears, which snakes lack, although this rule is not universal (see Amphisbaenia, Dibamidae, and Pygopodidae). Living snakes are found on every continent except Antarctica, and on most smaller land masses; exceptions include some large islands, such as Ireland, Iceland, Greenland, the Hawaiian archipelago, and the islands of New Zealand, and many small islands of the Atlantic and central Pacific oceans. Additionally, sea snakes are widespread throughout the Indian and Pacific Oceans. More than 20 families are currently recognized, comprising about 520 genera and about 3,600 species. They range in size from the tiny, 10.4 cm (4.1 in)-long Barbados thread snake to the reticulated python of 6.95 meters (22.8 ft) in length. The fossil species Titanoboa cerrejonensis was 12.8 meters (42 ft) long. Snakes are thought to have evolved from either burrowing or aquatic lizards, perhaps during the Jurassic period, with the earliest known fossils dating to between 143 and 167 Ma ago. The diversity of modern snakes appeared during the Paleocene epoch (c 66 to 56 Ma ago, after the Cretaceous–Paleogene extinction event). The oldest preserved descriptions of snakes can be found in the Brooklyn Papyrus. Most species are nonvenomous and those that have venom use it primarily to kill and subdue prey rather than for self-defense. Some possess venom potent enough to cause painful injury or death to humans. Nonvenomous snakes either swallow prey alive or kill by constriction."
30467 Tyrannosaurus "Tyrannosaurus is a genus of coelurosaurian theropod dinosaur. The species Tyrannosaurus rex (rex meaning ""king"" in Latin), often called T. rex or colloquially T-Rex, is one of the most well-represented of the large theropods. Tyrannosaurus lived throughout what is now western North America, on what was then an island continent known as Laramidia. Tyrannosaurus had a much wider range than other tyrannosaurids. Fossils are found in a variety of rock formations dating to the Maastrichtian age of the upper Cretaceous Period, 68 to 66 million years ago. It was the last known member of the tyrannosaurids, and among the last non-avian dinosaurs to exist before the Cretaceous–Paleogene extinction event. Like other tyrannosaurids, Tyrannosaurus was a bipedal carnivore with a massive skull balanced by a long, heavy tail. Relative to its large and powerful hind limbs, Tyrannosaurus forelimbs were short but unusually powerful for their size and had two clawed digits. The most complete specimen measures up to 12.3 m (40 ft) in length though T. rex could grow to lengths of over 12.3 m (40 ft), up to 3.66 meters (12 ft) tall at the hips, and according to most modern estimates 8.4 metric tons (9.3 short tons) to 14 metric tons (15.4 short tons) in weight. Although other theropods rivaled or exceeded Tyrannosaurus rex in size, it is still among the largest known land predators and is estimated to have exerted the strongest bite force among all terrestrial animals. By far the largest carnivore in its environment, Tyrannosaurus rex was most likely an apex predator, preying upon hadrosaurs, armored herbivores like ceratopsians and ankylosaurs, and possibly sauropods. Some experts have suggested the dinosaur was primarily a scavenger. The question of whether Tyrannosaurus was an apex predator or a pure scavenger was among the longest debates in paleontology. Most paleontologists today accept that Tyrannosaurus was both an active predator and a scavenger. More than fifty major specimens of Tyrannosaurus rex have been identified, some of which are nearly complete skeletons. Soft tissue and proteins have been reported in at least one of these specimens. The abundance of fossil material has allowed significant research into many aspects of its biology, including its life history and biomechanics. The feeding habits, physiology and potential speed of Tyrannosaurus rex are a few subjects of debate. Its taxonomy is also controversial, as some scientists consider Tarbosaurus bataar from Asia to be a second Tyrannosaurus species while others maintain Tarbosaurus is a separate genus. Several other genera of North American tyrannosaurids have also been synonymized with Tyrannosaurus. As the archetypal theropod, Tyrannosaurus has been one of the best-known dinosaurs since the early 20th century, and has been featured in film, advertising, postal stamps, and many other media."
30680 The_New_York_Times "The New York Times (sometimes abbreviated as the NYT and NYTimes) is an American newspaper based in New York City with worldwide influence and readership. Founded in 1851, the paper has won 127 Pulitzer Prizes, more than any other newspaper. The Times is ranked 18th in the world by circulation and 3rd in the U.S.The paper is owned by The New York Times Company, which is publicly traded and is controlled by the Sulzberger family through a dual-class share structure. It has been owned by the family since 1896; A.G. Sulzberger, the paper's publisher, and his father, Arthur Ochs Sulzberger Jr., the company's chairman, are the fourth and fifth generation of the family to head the paper.Nicknamed ""The Gray Lady,"" the Times has long been regarded within the industry as a national ""newspaper of record."" The paper's motto, ""All the News That's Fit to Print"", appears in the upper left-hand corner of the front page. Since the mid-1970s, The New York Times has greatly expanded its layout and organization, adding special weekly sections on various topics supplementing the regular news, editorials, sports, and features. Since 2008, the Times has been organized into the following sections: News, Editorials/Opinions-Columns/Op-Ed, New York (metropolitan), Business, Sports of The Times, Arts, Science, Styles, Home, Travel, and other features. On Sunday, the Times is supplemented by the Sunday Review (formerly the Week in Review), The New York Times Book Review, The New York Times Magazine and T: The New York Times Style Magazine. The Times stayed with the broadsheet full-page set-up and an eight-column format for several years after most papers switched to six, and was one of the last newspapers to adopt color photography, especially on the front page."
30770 The_Troubles "The Troubles (Irish: Na Trioblóidí) was an ethno-nationalist conflict in Northern Ireland during the late 20th century. Also known internationally as the Northern Ireland conflict, it is sometimes described as an ""irregular war"" or ""low-level war"". The conflict began in the late 1960s and is usually deemed to have ended with the Good Friday Agreement of 1998. Although the Troubles primarily took place in Northern Ireland, at times the violence spilled over into parts of the Republic of Ireland, England, and mainland Europe. The conflict was primarily political and nationalistic, fuelled by historical events. It also had an ethnic or sectarian dimension, although it was not a religious conflict. A key issue was the constitutional status of Northern Ireland. Unionists/loyalists, who were mostly Protestants, wanted Northern Ireland to remain within the United Kingdom. Irish nationalists/republicans, who were mostly Catholics, wanted Northern Ireland to leave the United Kingdom and join a united Ireland. The conflict began during a campaign to end discrimination against the Catholic/nationalist minority by the Protestant/unionist government and police force. The authorities attempted to suppress this protest campaign and were accused of police brutality; it was also met with violence from loyalists, who alleged it was a republican front. Increasing tensions led to severe violence in August 1969 and the deployment of British troops, in what became the British Army's longest ever operation. They built 'peace walls' to keep the two communities apart. Some Catholics initially welcomed the army as a more neutral force, but it soon came to be seen as hostile and biased, particularly after Bloody Sunday. The emergence of armed paramilitary organisations led to subsequent warfare over the next three decades. The main participants in the Troubles were republican paramilitaries such as the Provisional Irish Republican Army (IRA) and the Irish National Liberation Army (INLA); loyalist paramilitaries such as the Ulster Volunteer Force (UVF) and Ulster Defence Association (UDA); British state security forces—the British Army and Royal Ulster Constabulary (RUC); and political activists and politicians. The security forces of the Republic played a smaller role. Republican paramilitaries carried out a guerrilla campaign against British security forces, as well as a bombing campaign against infrastructure, commercial and political targets. Loyalists targeted republicans/nationalists, and attacked the wider Catholic community in what they described as retaliation. At times there were bouts of sectarian tit-for-tat violence. The British security forces undertook both a policing and a counter-insurgency role, primarily against republicans. There were some incidents of collusion between British security forces and loyalists. The Troubles also involved numerous riots, mass protests and acts of civil disobedience, and led to segregation and the creation of no-go areas. More than 3,500 people were killed in the conflict, of whom 52% were civilians, 32% were members of the British security forces, and 16% were members of paramilitary groups. There has been sporadic violence since the Good Friday Agreement was signed, including a campaign by anti-ceasefire republicans."
33545 Welsh_language "Welsh (Cymraeg [kəmˈrɑːɨɡ] (listen) or y Gymraeg [ə gəmˈrɑːɨɡ]) is a Brittonic language of the Celtic language family. It is spoken natively in Wales, by some in England, and in Y Wladfa (the Welsh colony in Chubut Province, Argentina). Historically, it has also been known in English as 'British', 'Cambrian', 'Cambric' and 'Cymric'.According to the United Kingdom Census 2011, 19 percent of residents in Wales aged three and over were able to speak Welsh. According to the 2001 Census, 21 per cent of the population aged 3+ were able to speak Welsh. This suggests that there was a decrease in the number of Welsh speakers in Wales from 2001 to 2011 – from about 582,000 to 562,000 respectively.  The Annual Population Survey conducted by the Office for National Statistics for the year ending in March 2019 suggest that 896,900 Welsh residents (30 per cent) aged three or over in Wales were able to speak Welsh. The results for the most recent National Survey for Wales (2017-2018) suggest that 19 per cent of the population aged 16 and over were able to speak Welsh, with an additional 12 per cent noting that they had ""some Welsh speaking ability"".The Welsh Language (Wales) Measure 2011 gave the Welsh language official status in Wales, making it the only language that is de jure official in any part of the United Kingdom, with English being de facto official. The Welsh language, along with English, is also a de jure official language of the National Assembly for Wales."
33557 Whaling "Whaling is the hunting of whales for their usable products such as meat and blubber, which can be turned into a type of oil which became increasingly important in the Industrial Revolution. It was practiced as an organized industry as early as 875 AD. By the 16th century, it had risen to be the principal industry in the coastal regions of Spain and France. The industry spread throughout the world, and became increasingly profitable in terms of trade and resources. Some regions of the world's oceans, along the animals' migration routes, had a particularly dense whale population, and became the targets for large concentrations of whaling ships, and the industry continued to grow well into the 20th century. The depletion of some whale species to near extinction led to the banning of whaling in many countries by 1969, and to a worldwide cessation of whaling as an industry in the late 1980s. The earliest forms of whaling date to at least circa 3000 BC. Coastal communities around the world have long histories of subsistence use of cetaceans, by dolphin drive hunting and by harvesting drift whales. Industrial whaling emerged with organized fleets of whaleships in the 17th century; competitive national whaling industries in the 18th and 19th centuries; and the introduction of factory ships along with the concept of whale harvesting in the first half of the 20th century. By the late 1930s more than 50,000 whales were killed annually. In 1986, the International Whaling Commission (IWC) banned commercial whaling because of the extreme depletion of most of the whale stocks.Contemporary whaling is subject to intense debate. Countries that support commercial whaling, notably Iceland, Japan, and Norway, wish to lift the ban on certain whale stocks for hunting. Anti-whaling countries and environmental groups oppose lifting the ban. Under the terms of the IWC moratorium, aboriginal whaling is allowed to continue on a subsistence basis. Over the past few decades, whale watching has become a significant industry in many parts of the world; in some countries it has replaced whaling, but in a few others, the two business models exist in an uneasy tension. The live capture of cetaceans for display in aquaria (e.g. captive killer whales) continues."
