103177 Daguerreotype "The daguerreotype (; French: daguerréotype) process, or daguerreotypy, was the first publicly available photographic process, widely used during the 1840s and 1850s. Invented by Louis-Jacques-Mandé Daguerre and introduced worldwide in 1839, daguerreotype was almost completely superseded by 1860 with new, less expensive processes yielding more readily viewable images. There was a revival of daguerreotypy in the late 20th century by a small number of photographers interested in making artistic use of early photographic processes. To make the image, a daguerrotypist would polish a sheet of silver-plated copper to a mirror finish, treat it with fumes that made its surface light sensitive, expose it in a camera for as long as was judged to be necessary, which could be as little as a few seconds for brightly sunlit subjects or much longer with less intense lighting; make the resulting latent image on it visible by fuming it with mercury vapor; remove its sensitivity to light by liquid chemical treatment, rinse and dry it, then seal the easily marred result behind glass in a protective enclosure. The image is on a mirror-like silver surface, normally kept under glass, and will appear either positive or negative, depending on the angle at which it is viewed, how it is lit and whether a light or dark background is being reflected in the metal. The darkest areas of the image are simply bare silver; lighter areas have a microscopically fine light-scattering texture. The surface is very delicate, and even the lightest wiping can permanently scuff it. Some tarnish around the edges is normal. Several types of antique photographs, most often ambrotypes and tintypes, but sometimes even old prints on paper, are very commonly misidentified as daguerreotypes, especially if they are in the small, ornamented cases in which daguerreotypes made in the US and UK were usually housed. The name ""daguerreotype"" correctly refers only to one very specific image type and medium, the product of a process that was in wide use only from the early 1840s to the late 1850s."
142528 Jeff_Bezos "Jeffrey Preston Bezos (; né Jorgensen; born January 12, 1964) is an American internet and aerospace entrepreneur, media proprietor,  and investor. He is best known as the founder, CEO, and president of Amazon.com, Inc. Bezos was born in Albuquerque, New Mexico, and raised in Houston, Texas. He graduated from Princeton University in 1986 with degrees in electrical engineering and computer science. He worked on Wall Street in a variety of related fields from 1986 to early 1994. He founded the online retailer Amazon in late 1994 on a cross-country road trip from New York City to Seattle. The company began as an online bookstore and has since expanded to a wide variety of other e-commerce products and services, including video and audio streaming, cloud computing, and artificial intelligence. It is currently the world's largest online sales company, the largest internet company by revenue, as well as the world's largest provider of AI assistance and cloud infrastructure services via its Amazon Web Services arm. Bezos added to his business interests when he founded the aerospace manufacturer and sub-orbital spaceflight services company Blue Origin in 2000. A Blue Origin test flight successfully first reached space in 2015, and the company has plans to begin commercial suborbital human spaceflight in 2019. He purchased major American newspaper publisher The Washington Post in 2013 for US$250 million in cash, and manages his other businesses and investments through his venture capital firm, Bezos Expeditions. On July 27, 2017, Bezos momentarily became the world's wealthiest person when his estimated net worth increased to just over $90 billion. His wealth surpassed $100 billion for the first time on November 24, 2017, and he was formally designated the wealthiest person in the world by Forbes on March 6, 2018, with a net worth of $112 billion. The first centi-billionaire on the Forbes wealth index, he was named the ""richest man in modern history"" after his net worth increased to $150 billion in July 2018. In September 2018, Forbes described Bezos as ""far richer than anyone else on the planet"" as he added $1.8 billion to his worth when Amazon's market cap briefly reached $1 trillion."
148475 Air_Force_One "Air Force One is the official air traffic control call sign for a United States Air Force aircraft carrying the President of the United States. In common parlance, the term is used to denote U.S. Air Force aircraft modified and used to transport the president. The aircraft are prominent symbols of the American presidency and its power.The idea of designating specific military aircraft to transport the President arose in 1943, when officials of the United States Army Air Forces, the predecessor to the U.S. Air Force, became concerned about using commercial airlines for presidential travel. A C-87 Liberator Express was reconfigured for use as the first dedicated VIP-and-presidential transport aircraft and named Guess Where II, but the Secret Service rejected it because of its safety record. A C-54 Skymaster was then converted for presidential use; dubbed the Sacred Cow, it carried President Franklin D. Roosevelt to the Yalta Conference in February 1945 and was used for another two years by President Harry S. Truman. The ""Air Force One"" call sign was created in 1953, after a Lockheed Constellation named Columbine II carrying President Dwight D. Eisenhower entered the same airspace as a commercial airline flight using the same flight number.Other Air Force Ones have included another Lockheed Constellation, Columbine III, and two Boeing 707s, introduced in the 1960s and 1970s. Since 1990, the presidential fleet has consisted of two Boeing VC-25As: highly customized Boeing 747-200B aircraft. The U.S. Air Force plans to buy two Boeing 747-8s to serve as the next Air Force Ones."
158894 Bill_Cosby "William Henry Cosby Jr. (; born July 12, 1937) is an American stand-up comedian, actor, musician, author, and convicted sex offender. He held an active career for over six decades before being convicted and imprisoned for sex offenses in 2018. Cosby began his career as a stand-up comic at the hungry i in San Francisco during the 1960s. He then landed a starring role in the television show I Spy, followed by his own sitcom The Bill Cosby Show, which ran for two seasons from 1969 to 1971. In 1972, using the Fat Albert character developed during his stand-up routines, Cosby created, produced, and hosted the animated comedy television series Fat Albert and the Cosby Kids which ran until 1985, centering on a group of young friends growing up in an urban area. Throughout the 1970s, Cosby starred in about a half-dozen films, and occasionally returned to film later in his career. In 1976, he earned his Doctor of Education from the University of Massachusetts Amherst. His dissertation discussed the use of Fat Albert and the Cosby Kids as a teaching tool in elementary schools. Beginning in the 1980s, Cosby produced and starred in the television sitcom The Cosby Show, which aired from 1984 to 1992 and was rated as the number one show in America for 1985 through 1989. The sitcom highlighted the experiences and growth of an affluent African-American family. Cosby produced the spin-off sitcom A Different World, which aired from 1987 to 1993. He also starred in The Cosby Mysteries from 1994 to 1995 and in the sitcom Cosby from 1996 to 2000, and hosted Kids Say the Darndest Things from 1998 to 2000. Cosby's reputation was tarnished during the mid-2010s by numerous women who made sexual assault accusations against him, the earliest dating back decades. More than 60 women have accused him of either attempted sexual assault, rape, drug-facilitated sexual assault, sexual battery, child sexual abuse, and sexual misconduct, which he had denied, and the statute of limitations had by then expired in nearly all cases. Cosby was found guilty of three counts of aggravated indecent assault and sentenced to three to ten years in prison in September 2018."
163395 Traffic_light "Traffic lights, also known as traffic signals, traffic lamps, traffic semaphore, signal lights, stop lights, redlights (In the Southern United States), robots (in South Africa, Zimbabwe and other parts of Africa), and traffic control signals in technical parlance, are signalling devices positioned at road intersections, pedestrian crossings, and other locations to control flows of traffic. The world's first traffic light was a manually operated gas-lit signal installed in London in December 1868. It exploded less than a month after it was implemented, injuring its policeman operator. Earnest Sirrine from Chicago patented the first automated traffic control system in 1910. It used the words ""STOP"" and ""PROCEED"", although neither word was illuminated.Traffic lights alternate the right of way accorded to users by illuminating lamps or LEDs of standard colours (red, amber (yellow), and green) following a universal colour code. In the typical sequence of colour phases:  The green light allows traffic to proceed in the direction denoted, if it is safe to do so and there is room on the other side of the intersection. The amber light warns that the signal is about to change to red.  In a number of European countries – among them the United Kingdom – a phase during which red and yellow are displayed together indicates that the signal is about to change to green. Actions required by drivers on a yellow light vary, with some jurisdictions requiring drivers to stop if it is safe to do so, and others allowing drivers to go through the intersection if safe to do so. A flashing amber indication is a warning signal. In the United Kingdom, a flashing amber light is used only at pelican crossings, in place of the combined red–amber signal, and indicates that drivers may pass if no pedestrians are on the crossing. The red signal prohibits any traffic from proceeding. A flashing red indication requires traffic to stop and then proceed when safe (equivalent to a stop sign).In some countries traffic signals will go into a flashing mode if the conflict monitor detects a problem, such as a fault that tries to display green lights to conflicting traffic. The signal may display flashing yellow to the main road and flashing red to the side road, or flashing red in all directions. Flashing operation can also be used during times of day when traffic is light, such as late at night."
166504 Phi_Beta_Kappa "The Phi Beta Kappa Society (ΦΒΚ) is the oldest academic honor society in the United States, and is often described as its most prestigious honor society, due to its long history and academic selectivity. Phi Beta Kappa aims to promote and advocate excellence in the liberal arts and sciences, and to induct the most outstanding students of arts and sciences at American colleges and universities. It was founded at the College of William and Mary on December 5, 1776 as the first collegiate Greek-letter fraternity and was among the earliest collegiate fraternal societies.Phi Beta Kappa (ΦΒΚ) stands for Φιλοσοφία Βίου Κυβερνήτης (Philosophia Biou Kybernētēs), which means ""Love of learning is the guide of life""."
167079 Smartphone "Smartphones are a class of mobile phones and of multi-purpose mobile computing devices. They are distinguished from feature phones by their stronger hardware capabilities and extensive mobile operating systems, which facilitate wider software, internet (including web browsing over mobile broadband), and multimedia functionality (including music, video, cameras, and gaming), alongside core phone functions such as voice calls and text messaging. Smartphones typically include various sensors that can be leveraged by their software, such as a magnetometer, proximity sensors, barometer, gyroscope and accelerometer, and support wireless communications protocols such as Bluetooth, Wi-Fi, and satellite navigation. Early smartphones were marketed primarily towards the enterprise market, attempting to bridge the functionality of standalone personal digital assistant (PDA) devices with support for cellular telephony, but were limited by their bulky form, short battery life, slow analog cellular networks, and the immaturity of wireless data services. These issues were eventually resolved with the exponential scaling and miniaturization of MOS transistors down to sub-micron levels (Moore's law), the improved lithium-ion battery, faster digital mobile data networks (Edholm's law), and more mature software platforms that allowed mobile device ecosystems to develop independently of data providers. In the 2000s, NTT DoCoMo's i-mode platform, BlackBerry, Nokia's Symbian platform, and Windows Mobile began to gain market traction, with models often featuring QWERTY keyboards or resistive touchscreen input, and emphasizing access to push email and wireless internet. Since the unveiling of the iPhone in 2007, the majority of smartphones have featured thin, slate-like form factors, with large, capacitive screens with support for multi-touch gestures rather than physical keyboards, and offer the ability for users to download or purchase additional applications from a centralized store, and use cloud storage and synchronization, virtual assistants, as well as mobile payment services. Improved hardware and faster wireless communication (due to standards such as LTE) have bolstered the growth of the smartphone industry. In the third quarter of 2012, one billion smartphones were in use worldwide. Global smartphone sales surpassed the sales figures for feature phones in early 2013."
168568 Film_speed "Film speed is the measure of a photographic film's sensitivity to light, determined by sensitometry and measured on various numerical scales, the most recent being the ISO system. A closely related ISO system is used to describe the relationship between exposure and output image lightness in digital cameras. Relatively insensitive film, with a correspondingly lower speed index, requires more exposure to light to produce the same image density as a more sensitive film, and is thus commonly termed a slow film. Highly sensitive films are correspondingly termed fast films. In both digital and film photography, the reduction of exposure corresponding to use of higher sensitivities generally leads to reduced image quality (via coarser film grain or higher image noise of other types). In short, the higher the sensitivity, the grainier the image will be. Ultimately sensitivity is limited by the quantum efficiency of the film or sensor."
176931 Internet_Archive "The Internet Archive is an American digital library with the stated mission of ""universal access to all knowledge."" It provides free public access to collections of digitized materials, including websites, software applications/games, music, movies/videos, moving images, and millions of public-domain books. In addition to its archiving function, the Archive is an activist organization, advocating for a free and open Internet. The Internet Archive allows the public to upload and download digital material to its data cluster, but the bulk of its data is collected automatically by its web crawlers, which work to preserve as much of the public web as possible. Its web archive, the Wayback Machine, contains hundreds of billions of web captures. The Archive also oversees one of the world's largest book digitization projects."
185239 Thermal_radiation "Thermal radiation is electromagnetic radiation generated by the thermal motion of particles in matter. All matter with a temperature greater than absolute zero emits thermal radiation. Particle motion results in charge-acceleration or dipole oscillation which produces electromagnetic radiation. The infrared radiation emitted by animals that is detectable with an infrared camera, and the cosmic microwave background radiation, are all examples of thermal radiation. If a radiation-emitting object meets the physical characteristics of a black body in thermodynamic equilibrium, the radiation is called blackbody radiation. Planck's law describes the spectrum of blackbody radiation, which depends solely on the object's temperature. Wien's displacement law determines the most likely frequency of the emitted radiation, and the Stefan–Boltzmann law gives the radiant intensity.Thermal radiation is also one of the fundamental mechanisms of heat transfer."
191902 Kerosene_lamp "A kerosene lamp (also known as a paraffin lamp in some countries) is a type of lighting device that uses kerosene as a fuel. Kerosene lamps have a wick or mantle as light source, protected by a glass chimney or globe; lamps may be used on a table, or hand-held lanterns may be used for portable lighting. Like oil lamps, they are useful for lighting without electricity, such as in regions without rural electrification, in electrified areas during power outages, at campsites, and on boats. There are three types of kerosene lamp: flat-wick, central-draught (tubular round wick), and mantle lamp. Kerosene lanterns meant for portable use have a flat wick and are made in dead-flame, hot-blast, and cold-blast variants. Pressurized kerosene lamps use a gas mantle; these are known as Petromax, Tilley lamps, or Coleman lamps, among other manufacturers. They produce more light per unit of fuel than wick-type lamps, but are more complex and expensive in construction and more complex to operate. A hand-pump pressurizes air, which forces liquid fuel from a reservoir into a gas chamber. Vapor from the chamber burns, heating a mantle to incandescence and also providing heat. Kerosene lamps are widely used for lighting in rural areas of Africa and Asia, where electricity is not distributed or is too costly. Kerosene lamps consume an estimated 77 billion litres of fuel per year, equivalent to 1.3 million barrels of oil per day, comparable to annual U.S. jet-fuel consumption of 76 billion litres per year."
195698 Wide-angle_lens "In photography and cinematography, a wide-angle lens refers to a lens whose focal length is substantially smaller than the focal length of a normal lens for a given film plane. This type of lens allows more of the scene to be included in the photograph, which is useful in architectural, interior and landscape photography where the photographer may not be able to move farther from the scene to photograph it. Another use is where the photographer wishes to emphasise the difference in size or distance between objects in the foreground and the background; nearby objects appear very large and objects at a moderate distance appear small and far away. This exaggeration of relative size can be used to make foreground objects more prominent and striking, while capturing expansive backgrounds.A wide angle lens is also one that projects a substantially larger image circle than would be typical for a standard design lens of the same focal length. This large image circle enables either large tilt & shift movements with a view camera, or a wide field of view. By convention, in still photography, the normal lens for a particular format has a focal length approximately equal to the length of the diagonal of the image frame or digital photosensor. In cinematography, a lens of roughly twice the diagonal is considered ""normal""."
195699 Telephoto_lens "In photography and cinematography, a telephoto lens is a specific type of a long-focus lens in which the physical length of the lens is shorter than the focal length. This is achieved by incorporating a special lens group known as a telephoto group that extends the light path to create a long-focus lens in a much shorter overall design. The angle of view and other effects of long-focus lenses are the same for telephoto lenses of the same specified focal length. Long-focal-length lenses are often informally referred to as telephoto lenses although this is technically incorrect: a telephoto lens specifically incorporates the telephoto group.Telephoto lenses are sometimes broken into the further sub-types of short telephoto (85mm to 135mm in 35mm film format), medium telephoto: (135mm to 300mm in 35mm film format) and super telephoto (over 300mm in 35mm film format) .  "
206515 Matsu_Islands "The Matsu Islands (Chinese: 馬祖列島; pinyin: Mǎzǔ Lièdǎo; Wade–Giles: Ma³-tsu³ Lieh⁴-tao³; Foochow Romanized: Mā-cū liĕk-dō̤) are an archipelago of 36 islands and islets in the East China Sea officially named Lienchiang County (Chinese: 連江縣; pinyin: Liánjiāng Xiàn; Wade–Giles: Lien²-chiang¹ Hsien⁴; Foochow Romanized: Lièng-gŏng-gâing) in the Republic of China (Taiwan). It is the smallest county of Taiwan Area. The historical Lienchiang County included both the Matsu Islands and today's Lianjiang County of the People's Republic of China (PRC). The PRC claims the three northern townships of the Matsu Islands as Matsu Township (馬祖鄉; Mǎzǔ Xiāng; Mā-cū hiŏng) and the southernmost islands as part of Changle District."
210411 International_Democrat_Union "The International Democrat Union (IDU) is an  international alliance of centrist to centre-right political parties.  Headquartered in Munich, Germany, the IDU comprises 73 full and associate members from 63 different countries. It is chaired by Stephen Harper, former Prime Minister of Canada. The IDU provides a forum in which political parties holding similar beliefs can come together and exchange views on matters of policy and organisational interest. From this, they act cooperatively, establish contacts, and present a unified voice toward the promotion of centre-right policies around the globe.  The IDU has some overlap of member parties with the Centrist Democrat International (CDI), but the CDI is more centrist and communitarian than the IDU.The group was founded in 1983 as the umbrella organisation for the European Democrat Union (EDU), Caribbean Democrat Union (CDU), and the Asia Pacific Democrat Union (APDU).  Created at the instigation of the Konrad Adenauer Foundation and US Vice President George H. W. Bush, the organisation was founded at a joint meeting of the EDU and APDU in London, England, UK.The IDU has several regional affiliates: the Democrat Union of Africa, the Union of Latin American Parties, the Asia Pacific Democrat Union, the Caribbean Democrat Union, and the European People's Party, the Alliance of Conservatives and Reformists in Europe and the (dormant since 2002) European Democrat Union in Europe.  It also has an affiliated youth wing the International Young Democrat Union led by Australian Simon Breheny and an affiliated women's wing in the International Women's Democrat Union."
215567 Pink "Pink is a pale red color that is named after a flower of the same name. It was first used as a color name in the late 17th century. According to surveys in Europe and the United States, pink is the color most often associated with charm, politeness, sensitivity, tenderness, sweetness, childhood, femininity and the romantic. A combination of pink and white is associated with chastity and innocence, whereas a combination of pink and black links to eroticism and seduction."
220533 Black_and_white "Black-and-white (B/W or B&W) images combine black and white in a continuous spectrum, producing a range of shades of gray."
230331 Oval_Office "The Oval Office is, since 1909, the working office space of the president of the United States, located in the West Wing of the White House, Washington, D.C. Opened in 1909, the room features three large south-facing windows behind the president's desk, and a fireplace at the north end. It has four doors: the east door opens to the Rose Garden; the west door leads to a private study and dining room; the northwest door opens onto the main corridor of the West Wing; and the northeast door opens to the office of the president's secretary. Presidents generally decorate the office to suit their personal taste, choosing new furniture, new drapery, and designing their own oval-shaped carpet to take up most of the floor. Artwork is selected from the White House's on collection, or borrowed from museums for the president's term in office."
237365 National_colours "National colours are frequently part of a country's set of national symbols. Many states and nations have formally adopted a set of colours as their official ""national colours"" while others have de facto national colours that have become well-known through popular use. National colours often appear on a variety of different media, from the nation's flag to the colours used in sports."
