17782843 Lady_Gaga "Stefani Joanne Angelina Germanotta (born March 28, 1986), known professionally as Lady Gaga, is an American singer, songwriter and actress. She is known for her unconventionality, provocative work and visual experimentation. Gaga began performing as a teenager, singing at open mic nights and acting in school plays. She studied at Collaborative Arts Project 21, through New York University's Tisch School of the Arts, before dropping out to pursue a music career. When Def Jam Recordings canceled her contract, she worked as a songwriter for Sony/ATV Music Publishing, where Akon helped her sign a joint deal with Interscope Records and his own label KonLive Distribution in 2007. She rose to prominence the following year with her debut album, the electropop record The Fame, and its chart-topping singles ""Just Dance"" and ""Poker Face"". A follow-up EP, The Fame Monster (2009), featuring the singles ""Bad Romance"", ""Telephone"" and ""Alejandro"", was also successful. Gaga's second full-length album, Born This Way (2011), explored electronic rock and techno-pop. It peaked atop the US Billboard 200 and sold more than one million copies in the country in its first week. Its title track became the fastest selling song on the iTunes Store with over a million downloads in less than a week. Gaga experimented with EDM on her third studio album, Artpop (2013), which reached number one in the US and included the single ""Applause"". Her collaborative jazz album with Tony Bennett, Cheek to Cheek (2014), and her soft rock-influenced fifth studio album, Joanne (2016), also topped the US charts. During this period, Gaga ventured into acting, playing leading roles in the miniseries American Horror Story: Hotel (2015–2016), for which she received a Golden Globe Award for Best Actress, and the critically acclaimed musical drama A Star Is Born (2018). She also contributed to the latter's soundtrack, which received the BAFTA Award for Best Film Music and made her the first woman to achieve five US number one albums in the 2010s. Its lead single, ""Shallow"", earned Gaga the Academy Award and the Golden Globe Award for Best Original Song. Having sold 27 million albums and 146 million singles as of January 2016, Gaga is one of the world's best-selling music artists. Her achievements include several Guinness world records, nine Grammy Awards, and awards from the Songwriters Hall of Fame and the Council of Fashion Designers of America. She has been declared Billboard's Artist of the Year and Woman of the Year, and included among Forbes's power and earnings rankings. She was ranked number four on VH1's Greatest Women in Music in 2012 and second on Time's 2011 readers' poll of the most influential people of the past ten years. She is known for her philanthropy and social activism, including her work related to LGBT rights, and for her nonprofit organization, the Born This Way Foundation, which focuses on empowering youth and preventing bullying."
18624945 True_Blood "True Blood is an American fantasy horror drama television series produced and created by Alan Ball. It was based on The Southern Vampire Mysteries, a series of novels by Charlaine Harris. The series revolves around Sookie Stackhouse (Anna Paquin), a telepathic waitress living in the fictional rural town of Bon Temps, Louisiana and is set two years after the invention of a synthetic blood product branded “Tru Blood” that has allowed vampires to ""come out of the coffin"" and let their presence to be known to mankind, chronicling the vampires' struggle for equal rights and assimilation, while anti-vampire organizations begin to gain power. Sookie's world is turned upside down when she falls in love with 173-year-old vampire Bill Compton (Stephen Moyer), and for the first time, she must navigate the trials and terrors of intimacy and relationships.The show was broadcast on the premium cable network HBO, in the United States, and was produced by HBO in association with Ball's production company, Your Face Goes Here Entertainment. The series premiered on September 7, 2008 and concluded on August 24, 2014, comprising seven seasons and 80 episodes. The first five seasons received highly positive reviews, and both nominations and wins for several awards, including a Golden Globe and an Emmy."
18933066 Florida "Florida ( (listen), Spanish pronunciation: [floˈɾi.ða]) is the southernmost contiguous state in the United States. The state is bordered to the west by the Gulf of Mexico, to the northwest by Alabama, to the north by Georgia, to the east by the Atlantic Ocean, and to the south by the Straits of Florida. Florida is the 22nd-most extensive (65,755 sq mi or 170,300 km2), the 3rd-most populous (21,312,211 inhabitants), and the 8th-most densely populated (384.3/sq mi or 148.4/km2) of the U.S. states. Jacksonville is the most populous municipality in the state and the largest city by area in the contiguous United States. The Miami metropolitan area is Florida's most populous urban area. Tallahassee is the state's capital. Florida's $1.0 trillion economy is the fourth largest in the United States. If it were a country, Florida would be the 16th largest economy in the world, and the 58th most populous as of 2018. In 2017, Florida's per capita personal income was $47,684, ranking 26th in the nation. The unemployment rate in September 2018 was 3.5% and ranked as the 18th in the United States. Florida exports nearly $55 billion in goods made in the state, the 8th highest among all states. The Miami Metropolitan Area is by far the largest urban economy in Florida and the 12th largest in the United States with a GDP of $345 billion as of 2017. This is more than twice the number of the next metro area, the Tampa Bay Area, which has a GDP of $145 billion. Florida is home to 51 of the world's billionaires with most of them residing in South Florida.The first European contact was made in 1513 by Spanish explorer Juan Ponce de León, who called it la Florida ([la floˈɾiða] ""the land of flowers"") upon landing there in the Easter season, known in Spanish as Pascua Florida. Florida was a challenge for the European colonial powers before it gained statehood in the United States in 1845. It was a principal location of the Seminole Wars against the Native Americans, and racial segregation after the American Civil War. Today, Florida is distinctive for its large Cuban expatriate community and high population growth, as well as for its increasing environmental issues. The state's economy relies mainly on tourism, agriculture, and transportation, which developed in the late 19th century. Florida is also renowned for amusement parks, orange crops, winter vegetables, the Kennedy Space Center, and as a popular destination for retirees. Florida is the flattest state in the United States. Lake Okeechobee is the largest freshwater lake in Florida.Florida's close proximity to the ocean influences many aspects of Florida culture and daily life. Florida is a reflection of influences and multiple inheritance; African, European, indigenous, and Latino heritages can be found in the architecture and cuisine. Florida has attracted many writers such as Marjorie Kinnan Rawlings, Ernest Hemingway and Tennessee Williams, and continues to attract celebrities and athletes. It is internationally known for golf, tennis, auto racing, and water sports. Several beaches in Florida have turquoise and emerald-colored coastal waters.About two-thirds of Florida occupies a peninsula between the Gulf of Mexico and the Atlantic Ocean. Florida has the longest coastline in the contiguous United States, approximately 1,350 miles (2,170 km), not including the contribution of the many barrier islands. Florida has a total of 4,510 islands that are ten acres or larger in area. This is the second-highest number of islands of any state in the United States; only Alaska has more. It is the only state that borders both the Gulf of Mexico and the Atlantic Ocean. Much of the state is at or near sea level and is characterized by sedimentary soil. Florida has the lowest high point of any U.S. state. The American alligator, American crocodile, American flamingo, Roseate spoonbill, Florida panther, bottlenose dolphin, and manatee can be found in Everglades National Park in the southern part of the state. The climate varies from subtropical in the north to tropical in the south. Along with Hawaii, Florida is one of only two states that has a tropical climate, and is the only continental state that has both a tropical climate and a coral reef. The Florida Reef is the only living coral barrier reef in the continental United States, and the third-largest coral barrier reef system in the world (after the Great Barrier Reef and Belize Barrier Reef)."
18952408 Split,_Croatia "Split (, as the English word split; Croatian pronunciation: [splît] (listen); see other names) is the second-largest city of Croatia and the largest city of the region of Dalmatia, with about 250,000 people living in its urban area. It lies on the eastern shore of the Adriatic Sea and is spread over a central peninsula and its surroundings. An intraregional transport hub and popular tourist destination, the city is linked to the Adriatic islands and the Apennine peninsula.  Home to Diocletian's Palace, built for the Roman emperor in AD 305, the city was founded as the Greek colony of Aspálathos (Aσπάλαθος) in the 3rd or 2nd century BC. It became a prominent settlement around 650 when it succeeded the ancient capital of the Roman province of Dalmatia, Salona. After the sack of Salona by the Avars and Slavs, the fortified Palace of Diocletian was settled by Roman refugees. Split became a Byzantine city. Later it drifted into the sphere of the Republic of Venice and the Kingdom of Croatia, with the Byzantines retaining nominal suzerainty. For much of the High and Late Middle Ages, Split enjoyed autonomy as a free city of the Dalmatian city-states, caught in the middle of a struggle between Venice and the Croatian-Hungarian Kingdom for control over the Dalmatian cities. Venice eventually prevailed and during the early modern period Split remained a Venetian city, a heavily fortified outpost surrounded by Ottoman territory. Its hinterland was won from the Ottomans in the Morean War of 1699, and in 1797, as Venice fell to Napoleon, the Treaty of Campo Formio rendered the city to the Habsburg Monarchy. In 1805, the Peace of Pressburg added it to the Napoleonic Kingdom of Italy and in 1806 it was included in the French Empire, becoming part of the Illyrian Provinces in 1809. After being occupied in 1813, it was eventually granted to the Austrian Empire following the Congress of Vienna, where the city remained a part of the Austrian Kingdom of Dalmatia until the fall of Austria-Hungary in 1918 and the formation of Yugoslavia. In World War II, the city was annexed by Italy, then liberated by the Partisans after the Italian capitulation in 1943. It was then re-occupied by Germany, which granted it to its puppet Independent State of Croatia. The city was liberated again by the Partisans in 1944, and was included in the post-war Socialist Yugoslavia, as part of its republic of Croatia. In 1991, Croatia seceded from Yugoslavia amid the Croatian War of Independence."
19009060 Anthropomorphism "Anthropomorphism is the attribution of human traits, emotions, or intentions to non-human entities. It is considered to be an innate tendency of human psychology.Personification is the related attribution of human form and characteristics to abstract concepts such as nations, emotions, and natural forces, such as seasons and weather. Both have ancient roots as storytelling and artistic devices, and most cultures have traditional fables with anthropomorphized animals as characters. People have also routinely attributed human emotions and behavioral traits to wild as well as domesticated animals."
19230351 Aquarium "An aquarium (plural: aquariums or aquaria) is a vivarium of any size having at least one transparent side in which aquatic plants or animals are kept and displayed. Fishkeepers use aquaria to keep fish, invertebrates, amphibians, aquatic reptiles such as turtles, and aquatic plants. The term ""aquarium"", coined by English naturalist Philip Henry Gosse, combines the Latin root aqua, meaning water, with the suffix -arium, meaning ""a place for relating to"". The aquarium principle was fully developed in 1850 by the chemist Robert Warington, who explained that plants added to water in a container would give off enough oxygen to support animals, so long as the numbers of animals did not grow too large. The aquarium craze was launched in early Victorian England by Gosse, who created and stocked the first public aquarium at the London Zoo in 1853, and published the first manual, The Aquarium: An Unveiling of the Wonders of the Deep Sea in 1854. An aquarium is a water-filled tank in which fish swim about. Small aquariums are kept in the home by hobbyists. There are larger public aquariums in many cities. This kind of aquarium is a building with fish and other aquatic animals in large tanks. A large aquarium may have otters, turtles, dolphins, and other sea animals. Most aquarium tanks also have plants.An aquarist owns fish or maintains an aquarium, typically constructed of glass or high-strength acrylic. Cuboid aquaria are also known as fish tanks or simply tanks, while bowl-shaped aquaria are also known as fish bowls. Size can range from a small glass bowl, under a gallon in volume, to immense public aquaria of several thousand gallons. Specialized equipment maintains appropriate water quality and other characteristics suitable for the aquarium's residents."
19373898 Basilisk "In European bestiaries and legends, a basilisk ( or , from the Greek βασιλίσκος basilískos, ""little king""; Latin regulus) is a legendary reptile reputed to be a serpent king, who can cause death with a single glance. According to the Naturalis Historia of Pliny the Elder, the basilisk of Cyrene is a small snake, ""being not more than twelve fingers in length"", that is so venomous, it leaves a wide trail of deadly venom in its wake, and its gaze is likewise lethal. Its weakness is the odor of the weasel & the tears of a griffin, which, according to Pliny, was thrown into the basilisk's hole, recognizable because some of the surrounding shrubs and grass had been scorched by its presence. It is possible that the legend of the basilisk and its association with the weasel in Europe was inspired by accounts of certain species of Asiatic snakes (such as the king cobra) and their natural predator, the mongoose."
20380793 List_of_things_named_after_Barack_Obama "This is a list of things named after Barack Obama,  the 44th President of the United States. This list includes proposed name changes."
20656228 Maize "Maize ( MAYZ; Zea mays subsp. mays, from Spanish: maíz after Taino: mahiz), also known as corn, is a cereal grain first domesticated by indigenous peoples in southern Mexico about 10,000 years ago. The leafy stalk of the plant produces pollen inflorescences and separate ovuliferous inflorescences called ears that yield kernels or seeds, which are fruits.Maize has become a staple food in many parts of the world, with the total production of maize surpassing that of wheat or rice. However, little of this maize is consumed directly by humans: most is used for corn ethanol, animal feed and other maize products, such as corn starch and corn syrup. The six major types of maize are dent corn, flint corn, pod corn, popcorn, flour corn, and sweet corn. Sugar-rich varieties called sweet corn are usually grown for human consumption as kernels, while field corn varieties are used for animal feed, various corn-based human food uses (including grinding into cornmeal or masa, pressing into corn oil, and fermentation and distillation into alcoholic beverages like bourbon whiskey), and as chemical feedstocks. Maize is also used in making ethanol and other biofuels. Maize is widely cultivated throughout the world, and a greater weight of maize is produced each year than any other grain. In 2014, total world production was 1.04 billion tonnes. Maize is the most widely grown grain crop throughout the Americas, with 361 million metric tons grown in the United States in 2014. Approximately 40% of the crop—130 million tons—is used for corn ethanol. Genetically modified maize made up 85% of the maize planted in the United States in 2009."
20715044 Game_of_Thrones "Game of Thrones is an American  fantasy drama television series created by David Benioff and D. B. Weiss for HBO. It is an adaptation of A Song of Ice and Fire, George R. R. Martin's series of fantasy novels, the first of which is A Game of Thrones. The show was both produced and filmed in Belfast and elsewhere in the United Kingdom. Filming locations also included Canada, Croatia, Iceland, Malta, Morocco, and Spain. The series premiered on HBO in the United States on April 17, 2011, and concluded on May 19, 2019, with 73 episodes broadcast over eight seasons.  Set on the fictional continents of Westeros and Essos, Game of Thrones has several plots and a large ensemble cast and follows several story arcs. One arc is about the Iron Throne of the Seven Kingdoms and follows a web of alliances and conflicts among the noble dynasties either vying to claim the throne or fighting for independence from it. Another focuses on the last descendant of the realm's deposed ruling dynasty, who has been exiled and is plotting a return to the throne, while another story arc follows the Night's Watch, a brotherhood defending the realm against the fierce peoples and legendary creatures of the North. Game of Thrones attracted a record viewership on HBO and has a broad, active, and international fan base. The series was acclaimed by critics for its acting, complex characters, story, scope, and production values, although its frequent use of nudity and violence (including sexual violence) was criticized; the final season received further criticism for its condensed story and creative decisions, with many considering it a disappointing conclusion. The series received 58 Primetime Emmy Awards, the most by a drama series, including Outstanding Drama Series in 2015, 2016, 2018, 2019. Its other awards and nominations include three Hugo Awards for Best Dramatic Presentation (2012–2014), a 2011 Peabody Award, and five nominations for the Golden Globe Award for Best Television Series – Drama (2012 and 2015–2018). In 2019, the show's final season established a new record for most Emmy nominations received in the same year by any regular series with 32, breaking the 25 years long record of 26 nominations established by NYPD Blue in 1994; it also established Game of Thrones as the drama series with the most overall Emmy nominations, with a total of 161.Of the ensemble cast, Peter Dinklage has won four Primetime Emmy Awards for Outstanding Supporting Actor in a Drama Series (2011, 2015, 2018, and 2019) and the Golden Globe Award for Best Supporting Actor – Series, Miniseries or Television Film (2012) for his performance as Tyrion Lannister. Alfie Allen, Gwendoline Christie, Emilia Clarke, Nikolaj Coster-Waldau, Lena Headey, Kit Harington, Sophie Turner, Diana Rigg, Carice van Houten, Max von Sydow, and Maisie Williams have also received Primetime Emmy Award nominations for their performances."
21163084 The_Electric_Company_(2009_TV_series) "The Electric Company is an American television series for young children ages 6 to 10 on PBS, derived from the 1971 series, and which has the same Alphakids from that series. Like the original, this version was produced by Sesame Workshop. The series ran on PBS Kids Go! from January 23, 2009 to April 4, 2011. A fourth season was planned, but the show was canceled before it went into production. Subsequent showings were reruns. The series was sometimes referred to as The New Electric Company to distinguish it from the 1970s series."
21995557 Encyclopedia_(TV_series) "Encyclopedia is a television series created by the HBO Network and the for-profit branch of the Children's Television Workshop (CTW) (now known as Sesame Workshop), Distinguished Productions, Inc. (DPI), (now which has been folded into Sesame Workshop). The series premiered on the HBO network in 1988. Each episode covered a letter or series of letters in the alphabet, with short skits of sketch comedy devoted to up to twelve corresponding encyclopedia topics. Several topics were related through song. Three of the six writers of the show had also been writers for NBC's Saturday Night Live: Patricia Marx, Brian McConnachie, and Mitchell Kriegman. The series featured the band BETTY, who performed both the opening and closing themes as well as individual songs for selected topics."
23141006 Orc "An orc  (also spelled ork) is a fictional humanoid creature that is part of a fantasy race akin to goblins.  While the overall concept of orcs draws on a variety of pre-existing mythology, the main conception of the creatures stems from the fantasy writings of J. R. R. Tolkien, in particular The Lord of the Rings. In Tolkien's works, orcs are a brutish, aggressive, repulsive and generally malevolent species, existing in stark contrast with the benevolent Elvish race and generally serving an evil power. Tolkien's concept of orcs has subsequently been adapted and imported into other works of fantasy fiction as well as role-playing and strategy games (such as Dungeons & Dragons, Warhammer, and Warcraft), broadening the recognition of the creatures in popular culture. Earlier references to creatures etymologically or conceptually similar to orcs can be found in Anglo-Saxon sources, including Beowulf, and 16th-century Italian folk tales, in particular those of Giambattista Basile."
23534170 Fantasy "Fantasy is a genre of speculative fiction set in a fictional universe, often inspired by real world myth and folklore. Its roots are in oral traditions, which then became literature and drama. From the twentieth century it has expanded further into various media, including film, television, graphic novels, manga and video games. Fantasy is distinguished from the genres of science fiction and horror by the absence of scientific or macabre themes respectively, though these genres overlap. In popular culture, the fantasy genre predominantly features settings of a medieval nature. In its broadest sense, however, fantasy consists of works by many writers, artists, filmmakers, and musicians from ancient myths and legends to many recent and popular works."
23538713 Bat "Bats are mammals of the order Chiroptera; with their forelimbs adapted as wings, they are the only mammals naturally capable of true and sustained flight. Bats are more manoeuvrable than birds, flying with their very long spread-out digits covered with a thin membrane or patagium. The smallest bat, and arguably the smallest extant mammal, is Kitti's hog-nosed bat, which is 29–34 mm (1.14–1.34 in) in length, 15 cm (5.91 in) across the wings and 2–2.6 g (0.07–0.09 oz) in mass. The largest bats are the flying foxes and the giant golden-crowned flying fox, Acerodon jubatus, which can weigh 1.6 kg (4 lb) and have a wingspan of 1.7 m (5 ft 7 in). The second largest order of mammals after rodents, bats comprise about 20% of all classified mammal species worldwide, with over 1,200 species. These were traditionally divided into two suborders: the largely fruit-eating megabats, and the echolocating microbats. But more recent evidence has supported dividing the order into Yinpterochiroptera and Yangochiroptera, with megabats as members of the former along with several species of microbats. Many bats are insectivores, and most of the rest are frugivores (fruit-eaters). A few species feed on animals other than insects; for example, the vampire bats feed on blood. Most bats are nocturnal, and many roost in caves or other refuges; it is uncertain whether bats have these behaviours to escape predators. Bats are present throughout the world, with the exception of extremely cold regions. They are important in their ecosystems for pollinating flowers and dispersing seeds; many tropical plants depend entirely on bats for these services. Bats provide humans with some benefits, at the cost of some threats. Bat dung has been mined as guano from caves and used as fertiliser. Bats consume insect pests, reducing the need for pesticides. They are sometimes numerous enough to serve as tourist attractions, and are used as food across Asia and the Pacific Rim. They are natural reservoirs of many pathogens, such as rabies; and since they are highly mobile, social, and long-lived, they can readily spread disease. In many cultures, bats are popularly associated with darkness, malevolence, witchcraft, vampires, and death."
